{
  "blocked": null,
  "checkpoints": [
    {
      "artifact": "sdf-table3-mape-public-three",
      "asset": "lucy",
      "bytes": 186781,
      "config_sha256": "c6333d00d075979e1cf8a31e001ea1d7ea33310f32a3f14dc0f66bd19bac9cbd",
      "job_index": 0,
      "loss": "mape",
      "method": "PE",
      "method_key": "pe",
      "path": "results/work/sdf-repro/670335310fb1319fa825385b/sdf-table3-mape-public-three/c6333d00d075979e/checkpoints/lucy/PE/seed-0.pt",
      "seed": 0,
      "sha256": "435ddee46df634bf28c7388cc7d27c12d1fe560f16f023e2c3862c2d622a17f2",
      "step": 120000,
      "total_steps": 120000
    },
    {
      "artifact": "sdf-table3-mape-public-three",
      "asset": "lucy",
      "bytes": 7231425,
      "config_sha256": "c6333d00d075979e1cf8a31e001ea1d7ea33310f32a3f14dc0f66bd19bac9cbd",
      "job_index": 1,
      "loss": "mape",
      "method": "LPE",
      "method_key": "lpe",
      "path": "results/work/sdf-repro/670335310fb1319fa825385b/sdf-table3-mape-public-three/c6333d00d075979e/checkpoints/lucy/LPE/seed-0.pt",
      "seed": 0,
      "sha256": "f2de662791ca43d44f65f3eb251b6dfb008f9e3faa15a51ef6d046427207ced1",
      "step": 120000,
      "total_steps": 120000
    },
    {
      "artifact": "sdf-table3-mape-public-three",
      "asset": "lucy",
      "bytes": 7231425,
      "config_sha256": "c6333d00d075979e1cf8a31e001ea1d7ea33310f32a3f14dc0f66bd19bac9cbd",
      "job_index": 2,
      "loss": "mape",
      "method": "TI-Grid",
      "method_key": "grid",
      "path": "results/work/sdf-repro/670335310fb1319fa825385b/sdf-table3-mape-public-three/c6333d00d075979e/checkpoints/lucy/TI-Grid/seed-0.pt",
      "seed": 0,
      "sha256": "2c3493322e9bca0a70621b6c4990dcc5540e82f6b5ae514b655a61094bb646fd",
      "step": 120000,
      "total_steps": 120000
    },
    {
      "artifact": "sdf-table3-mape-public-three",
      "asset": "lucy",
      "bytes": 7314561,
      "config_sha256": "c6333d00d075979e1cf8a31e001ea1d7ea33310f32a3f14dc0f66bd19bac9cbd",
      "job_index": 3,
      "loss": "mape",
      "method": "Grid-PEPS",
      "method_key": "grid_peps",
      "path": "results/work/sdf-repro/670335310fb1319fa825385b/sdf-table3-mape-public-three/c6333d00d075979e/checkpoints/lucy/Grid-PEPS/seed-0.pt",
      "seed": 0,
      "sha256": "a68284312ead67044ec02f3bfd9a214a5cfac7d53c949d587e55cc37d298f3a0",
      "step": 120000,
      "total_steps": 120000
    },
    {
      "artifact": "sdf-table3-mape-public-three",
      "asset": "lucy",
      "bytes": 7231425,
      "config_sha256": "c6333d00d075979e1cf8a31e001ea1d7ea33310f32a3f14dc0f66bd19bac9cbd",
      "job_index": 4,
      "loss": "mape",
      "method": "Hash",
      "method_key": "hash",
      "path": "results/work/sdf-repro/670335310fb1319fa825385b/sdf-table3-mape-public-three/c6333d00d075979e/checkpoints/lucy/Hash/seed-0.pt",
      "seed": 0,
      "sha256": "fcde36c5b7c459c6df0b8640c23c6ac15ea8294bb31de4f8fbb148965a240ebc",
      "step": 120000,
      "total_steps": 120000
    },
    {
      "artifact": "sdf-table3-mape-public-three",
      "asset": "lucy",
      "bytes": 7314561,
      "config_sha256": "c6333d00d075979e1cf8a31e001ea1d7ea33310f32a3f14dc0f66bd19bac9cbd",
      "job_index": 5,
      "loss": "mape",
      "method": "Hash-PEPS",
      "method_key": "hash_peps",
      "path": "results/work/sdf-repro/670335310fb1319fa825385b/sdf-table3-mape-public-three/c6333d00d075979e/checkpoints/lucy/Hash-PEPS/seed-0.pt",
      "seed": 0,
      "sha256": "003f26bf3949d638258702e4ceeb920a83317ad8d5631e9ede0a658df40800e1",
      "step": 120000,
      "total_steps": 120000
    },
    {
      "artifact": "sdf-table3-mape-public-three",
      "asset": "lucy",
      "bytes": 7323017,
      "config_sha256": "c6333d00d075979e1cf8a31e001ea1d7ea33310f32a3f14dc0f66bd19bac9cbd",
      "job_index": 6,
      "loss": "mape",
      "method": "M-Grid",
      "method_key": "m_grid",
      "path": "results/work/sdf-repro/670335310fb1319fa825385b/sdf-table3-mape-public-three/c6333d00d075979e/checkpoints/lucy/M-Grid/seed-0.pt",
      "seed": 0,
      "sha256": "640ff49670a8fbc20937d87a392c67409f2a0d460803e5ec930edde161c3468b",
      "step": 120000,
      "total_steps": 120000
    },
    {
      "artifact": "sdf-table3-mape-public-three",
      "asset": "lucy",
      "bytes": 7350857,
      "config_sha256": "c6333d00d075979e1cf8a31e001ea1d7ea33310f32a3f14dc0f66bd19bac9cbd",
      "job_index": 7,
      "loss": "mape",
      "method": "M-PEPS",
      "method_key": "m_peps",
      "path": "results/work/sdf-repro/670335310fb1319fa825385b/sdf-table3-mape-public-three/c6333d00d075979e/checkpoints/lucy/M-PEPS/seed-0.pt",
      "seed": 0,
      "sha256": "a4c6b5ea301209c73456dab4dbb9cf2259660d733edfc9896d79df66c83b5073",
      "step": 120000,
      "total_steps": 120000
    },
    {
      "artifact": "sdf-table3-mape-public-three",
      "asset": "lucy",
      "bytes": 7325613,
      "config_sha256": "c6333d00d075979e1cf8a31e001ea1d7ea33310f32a3f14dc0f66bd19bac9cbd",
      "job_index": 8,
      "loss": "mape",
      "method": "M-Hash",
      "method_key": "m_hash",
      "path": "results/work/sdf-repro/670335310fb1319fa825385b/sdf-table3-mape-public-three/c6333d00d075979e/checkpoints/lucy/M-Hash/seed-0.pt",
      "seed": 0,
      "sha256": "80ac129266f6d7bb66fcae1bdab3f1b0c2ea6d97042f0a0793c11790051a5376",
      "step": 120000,
      "total_steps": 120000
    },
    {
      "artifact": "sdf-table3-mape-public-three",
      "asset": "lucy",
      "bytes": 7362669,
      "config_sha256": "c6333d00d075979e1cf8a31e001ea1d7ea33310f32a3f14dc0f66bd19bac9cbd",
      "job_index": 9,
      "loss": "mape",
      "method": "M-HashPEPS",
      "method_key": "m_hashpeps",
      "path": "results/work/sdf-repro/670335310fb1319fa825385b/sdf-table3-mape-public-three/c6333d00d075979e/checkpoints/lucy/M-HashPEPS/seed-0.pt",
      "seed": 0,
      "sha256": "e3fc598ce95c8b1a415bf11dbd6c8e1bb85e58f515af6c290243e16dd665220f",
      "step": 120000,
      "total_steps": 120000
    },
    {
      "artifact": "sdf-table3-mape-public-three",
      "asset": "thai-statue",
      "bytes": 186781,
      "config_sha256": "c6333d00d075979e1cf8a31e001ea1d7ea33310f32a3f14dc0f66bd19bac9cbd",
      "job_index": 10,
      "loss": "mape",
      "method": "PE",
      "method_key": "pe",
      "path": "results/work/sdf-repro/670335310fb1319fa825385b/sdf-table3-mape-public-three/c6333d00d075979e/checkpoints/thai-statue/PE/seed-0.pt",
      "seed": 0,
      "sha256": "25037568531b5c9cb3d43aeb3c9077b99bbdea8586e62a146e4b87c3e85102e0",
      "step": 120000,
      "total_steps": 120000
    },
    {
      "artifact": "sdf-table3-mape-public-three",
      "asset": "thai-statue",
      "bytes": 7231425,
      "config_sha256": "c6333d00d075979e1cf8a31e001ea1d7ea33310f32a3f14dc0f66bd19bac9cbd",
      "job_index": 11,
      "loss": "mape",
      "method": "LPE",
      "method_key": "lpe",
      "path": "results/work/sdf-repro/670335310fb1319fa825385b/sdf-table3-mape-public-three/c6333d00d075979e/checkpoints/thai-statue/LPE/seed-0.pt",
      "seed": 0,
      "sha256": "1eddb063c89e42540bcb3ff802c127b2f6e7e289877af86ae8741c2aed8ec0c3",
      "step": 120000,
      "total_steps": 120000
    },
    {
      "artifact": "sdf-table3-mape-public-three",
      "asset": "thai-statue",
      "bytes": 7231489,
      "config_sha256": "c6333d00d075979e1cf8a31e001ea1d7ea33310f32a3f14dc0f66bd19bac9cbd",
      "job_index": 12,
      "loss": "mape",
      "method": "TI-Grid",
      "method_key": "grid",
      "path": "results/work/sdf-repro/670335310fb1319fa825385b/sdf-table3-mape-public-three/c6333d00d075979e/checkpoints/thai-statue/TI-Grid/seed-0.pt",
      "seed": 0,
      "sha256": "b8e2d815d90f0c3ac04fe36168af4b7cb82205aeef96aa113651c8a60bf9ad44",
      "step": 120000,
      "total_steps": 120000
    },
    {
      "artifact": "sdf-table3-mape-public-three",
      "asset": "thai-statue",
      "bytes": 7314561,
      "config_sha256": "c6333d00d075979e1cf8a31e001ea1d7ea33310f32a3f14dc0f66bd19bac9cbd",
      "job_index": 13,
      "loss": "mape",
      "method": "Grid-PEPS",
      "method_key": "grid_peps",
      "path": "results/work/sdf-repro/670335310fb1319fa825385b/sdf-table3-mape-public-three/c6333d00d075979e/checkpoints/thai-statue/Grid-PEPS/seed-0.pt",
      "seed": 0,
      "sha256": "4638eeb9def606a871d008cc0b5217b62ce642228871d44fbbf22bf4798f9f65",
      "step": 120000,
      "total_steps": 120000
    },
    {
      "artifact": "sdf-table3-mape-public-three",
      "asset": "thai-statue",
      "bytes": 7231425,
      "config_sha256": "c6333d00d075979e1cf8a31e001ea1d7ea33310f32a3f14dc0f66bd19bac9cbd",
      "job_index": 14,
      "loss": "mape",
      "method": "Hash",
      "method_key": "hash",
      "path": "results/work/sdf-repro/670335310fb1319fa825385b/sdf-table3-mape-public-three/c6333d00d075979e/checkpoints/thai-statue/Hash/seed-0.pt",
      "seed": 0,
      "sha256": "985f587e62ab2a23c99b84db0460690d29bfffd946f3ee3f23d119cf39ab6c73",
      "step": 120000,
      "total_steps": 120000
    },
    {
      "artifact": "sdf-table3-mape-public-three",
      "asset": "thai-statue",
      "bytes": 7314561,
      "config_sha256": "c6333d00d075979e1cf8a31e001ea1d7ea33310f32a3f14dc0f66bd19bac9cbd",
      "job_index": 15,
      "loss": "mape",
      "method": "Hash-PEPS",
      "method_key": "hash_peps",
      "path": "results/work/sdf-repro/670335310fb1319fa825385b/sdf-table3-mape-public-three/c6333d00d075979e/checkpoints/thai-statue/Hash-PEPS/seed-0.pt",
      "seed": 0,
      "sha256": "92f292fd03817a65611c9d28f662bf6f4a014680cae90218ae0558198b8fd3d8",
      "step": 120000,
      "total_steps": 120000
    },
    {
      "artifact": "sdf-table3-mape-public-three",
      "asset": "thai-statue",
      "bytes": 7323017,
      "config_sha256": "c6333d00d075979e1cf8a31e001ea1d7ea33310f32a3f14dc0f66bd19bac9cbd",
      "job_index": 16,
      "loss": "mape",
      "method": "M-Grid",
      "method_key": "m_grid",